Emotion,Comment
2,"When my rights to use a shared house had been usurped by  
co-owners out of pure selfishness."
4,"Viewing the nuclear war film ""Threads""."
0,Family member survived an operation.
1,"I was walking to my car at night and thought that I was being  
followed."
4,When I became aware that an acquaintance had stolen from friends.
5,Caught cheating on a diet.
6,I had shown anger toward my dog and he was killed later that day.
0,A close married friend has just had his first child.
1,"Stranded in the north of Fraser Island with a submerged 4 WD hire  
vehicle."
2,"Not being alowed on a school camp with the class I'd been in for  
11 years (I had stayed down due to illness)"
4,"A female friend was violently ill on the return journey from a  
wedding reception we attended. Getting her out of the car when  
home took quite a while."
5,Cheating in a minor geography exam at school.
0,Having received an offer to do post-graduate work.
1,"Taking a trip to crocokile country I fell out of the boat and was  
motivated by fear of being eaten to perform great swimming feats."
2,"Last night - finding that someone in the house had eaten an  
entire packet of almonds I had bought for a family treat."
3,"The loss of my father as he died of a massive and sudden heart  
attack."
4,"When after a party celebrating a friend's 21st birthday - upon  
leaving I found 10 people outside throwing up and further 4  
unconscious."
5,"Having had a very heated argument with my sister - I began  
hitting her about the head with a newspaper I was holding."
0,"Winning a tight tennis match. One set to play, and the team was  
behind by 3 games. We won the last set 6-2 and won the match by a  
game."
3,Death of the family dog.
4,"We had friends to dinner and one of them threw a beer bottle in  
the air, and it bounced on an expensive table and damaged the  
table .The person did not apologise."
5,"After making a joke about a friend's marriage that was too  
personal."
6,"Carried out a vandalistic act on some windows at an old army  
location."
0,"Arriving in New Zealand as a teenager - first overseas trip -  
something ""exhilarating"" about the change of scenery etc."
1,"As a child (i.e. 5-7) hiking in reasonably rugged bush and  
becoming lost for a duration of 5-7 hours."
2,"Following an argument with my brother, he broke my golf clubs."
3,"Leaving the house myself and a female friend had shared for 6-8  
months because of the friendship which developed and our approach  
to each other in occasional instances of several personal crises."
4,"Discovering a good friend had lied to me, resulting in a  
detrimental relationship with another person."
6,"Leaving University in 1982 following exclusion and lying to  
parents/friends about reasons for leaving, i.e. lying about the  
fact of having been excluded."
0,"Going to a friend's wedding and seeing many of my old friends  
whom I had known before I moved to a new district five years  
previously."
1,"Car accident. Travelling as a passenger along narrow bitumen road  
at night - trying to overtake semi-trailer. The truck pulled over  
onto our side and we hit the wet dirt, swerved back into the  
truck, back onto the verge, over a guide post and into a ditch."
2,"At school when I had a shouting argument with a friend over my  
ability to carry out a particular duty in the correct way without  
harming her."
3,"Looking up end-of-semester results, and finding I'd failed three  
out of seven (subjects)."
4,"When I found out some family friends were embezzelling the  
company they worked for - using company petrol and food supplies  
and claiming furniture and crockery."
6,"After having told an authority figure a very large lie I was told  
she believed me, because she believed I had never lied to her. "
0,"After being away on a holiday for 2 months, a friend, who lived  
interstate, had remembered when I'd get back and phoned to  
welcome me home on the night of my arrival."
1,Walking along with a dog barking at you and following you.
2,"Doing a group assignment and being left to do all the work and  
take the blame for any mistakes."
4,Someone ruining someone's property just for the fun of it.
5,"A friend giving me an expensive Christmas gift while I gave her a  
cheap one."
6,Talking about someone behind their back.
1,"I was in about Grade 7, I came home from school one day and was told  
that my mother had skin cancer and would have to go to the hospital  
straight away."
2,"Brother provoked anger. It was when mother and father were away  
and we had to look after ourselves. He accused me of being  
selfish and a snob."
5,"Had a very good friend. We grew apart I found myself running her  
down to other friends."
0,"When I won the ""Under 18"" Showjumping at the Brookfield Show. The  
competition was very stiff and there were many riders competing."
1,"When I was on holiday, walking back to where I was staying, at  
night, and two men started closely following me. There was nobody  
around that I could run to."
3,"I was terribly upset when my kitten got hit by a car. He didn't  
die, but for several weeks we thought he might have to be put  
down."
5,"When I hadn't studied for an exam, so I pretended to be sick so I  
wouldn't have to go to school. I lied to my mother - she realized  
I had been lying when she got home from work and found that I had  
been over to a friend's place."
6,"When I was young, I stole some money from my mother's purse. It  
wasn't very much, but I can remember when she found it gone I  
felt very guilty."
1,First day at University (I didn't know what to expect).
2,"At a school dance when my supposed ""best friend"" kept walking  
away from me whenever I came near her."
3,"At end of school - function to ""celebrate"" ? Leaving friends who  
I'd known for up to 12 years."
4,"While watching a film of an experimental operation on a cat's  
brain in which the cat had metal pieces protruding from its eyes,  
mouth etc. to keep the head stable while being cut open."
6,"After having been told not to take the car, I took it anyway and  
felt guilty about having taken it."
0,"Eating biscuits and drinking Milo (Chocolate energy drink made  
with milk and usually drunk warm) with my friend at College. We  
get on really well, don't withold any feelings about each other's  
friends and are pretty good at cheering each other up when we are  
homesick."
1,"Going to a disco by myself to wait for some friends. We had  
separated and hadn't planned where to meet. I wasn't sure if they  
were even going to this place so I felt very conscious of being  
alone."
2,"A person ignored my advice, did not pay any attention to what was  
saying. She acted as though I wasn't even there. We were doing  
group work so everybody had the right to speak yet she just  
ignored me. She made me feel insignificant."
4,"At school, when the only thing people my age could think of was getting  
rolling drunk. They couldn't have a good time without firstly  
getting drunk."
5,"A girl I was with yelled something out to this group of guys I  
knew. It sounded really childish."
6,"I didn't tell my parents exacly what had made me so late in  
getting home one night. I left out some details and somehow, I  
felt I had lied to them."
1,"When cleaning up a pile of junk under our house, a huge spider (a  
""Jungle Spider"") ran out near me. (I do not like even small  
spiders)."
2,"At the hardware store, trying to convert Imperial to Metric  
measurements, I made a mistake, and didn't buy enough tiles for  
the bathroom. I was angry at myself, because I hope to be a Maths  
teacher."
4,"During the PY 102 film session on Tuesday, one of the films shown   
was of an experiment on a live cat involving strapping it into a  
machine for possibly days, and doing things to its brain."
5,"Several years ago I was caught riding the train without a ticket.  
The station-mistress treated me like a criminal almost."
0,"I got a good reaction from my tutor and tutorial group for a  
presentation I'd given that I was very worried about."
1,"A man was yelling outside my window at 3.00 am, yelling threats,  
though not to me."
2,"Going away for the weekend, leaving my College room open - when I  
returned several friends had had a party there, leaving the mess."
3,Passing away of my father.
4,"At a party where the boys were telling revolting stories about  
the girls they'd been with."
1,"Walking around the University at night by myself, having been  
previously warned of rapes, etc."
2,"When I received the mark well above requirements for the course I  
wanted to enter, yet I was not accepted - anger at the injustice  
of it, because I didn't receive early release of H.S.C. marks."
3,"When I left all my friends at school (break up) knowing we would  
probably all go our separate ways, and none see one another for a  
long time."
5,"When I was little and didn't own up to placing a lolly on the  
varnish, this pulled it all off and I didn't admit my guilt."
6,"I felt guilty when I skipped a two hour practical class I knew I  
would miss out on more information which I did not know, but I  
couldn't cope with going."
1,"At the tender age of eleven a friend and I left a party and  
proceeded to walk through dark and secluded streets of a bad  
neighborhood to find a telephone (recent spate of Horror Movie  
watching had occurred)."
2,"In a situation whereby a friend's actions were deliberately  
against my wishes and (with) no regard to my feelings."
3,"I broke up with my boyfriend of seven months, but it was a very  
""indepth"" relationship and so after feelings of grief and loss  
were over I felt an immense sadness."
0,Getting back with my boyfriend after a year away - apart.
1,Having my luggage checked at Customs.
2,When a friend wouldn't speak to me and wouldn't tell me why.
3,Thinking about friends overseas.
4,Hearing of a filthy situation over the phone.
5,Sending pictures home when I'd put on so much weight.
6,Borrowed someone else's towel without asking.
0,"When I opened my TE Score envelope, and saw I got into  
Physiotherapy."
1,When I was bringing in the shopping and nearly stood on a snake.
3,"At our Senior dinner - separated from school friends, nothing  
will ever be the same again."
6,"When I used to tell Mum I was going somewhere else than where I  
was (going)."
0,"When my brothers had passed all of their exams and were able to   
graduate from their courses."
1,When I was caught in an elevator and it got stuck between floors.
2,When I was put into a tennis team below my standard.
1,"When somebody broke into our home one night when my mother was  
out, and my sister and I had just gone to bed."
3,"When my father passed away of cancer, I was extremely saddened.  
He was not very old, which made matters worse. The actual death  
was horrendous, but the moving funeral saddened me more so."
4,"When walking along the beach with my boyfriend, we saw 2 people  
having sex on the sand dunes in full view of everyone. It was the  
fact that they chose that area in which to have sex, that  
disgusted me."
4,"I stayed at the Coast for a weekend with friends. My brother came  
to drive me home, but was rude, and in a hurry to rejoin his  
friends. I was embarrassed because the family involved was  
extremely nice, and hospitable to him."
6,"I ate 12 biscuits one night after tea while watching TV - I don't  
know why."
1,"I was seven years old and swimming outside the flags at the Gold  
Coast. I was caught in a rip and taken out about 100 m. I  
couldn't swim too well, but an older friend (17) swam out and  
saved me."
2,"While at school I had to write an essay for doing something wrong  
that I didn't do. I wrote the essay about how I was mistreated and  
got Saturday morning detention along with a few other kids, but  
they didn't show up."
3,When one of my closest friends died unexpectantly.
5,Lying to a friend about something that was trivial.
6,"I had promised to do a task for someone that was close to me, and  
from the outset I knew it was important that I do it, but when it  
came to it, I let them down."
2,"Getting terrible meals, but paying heaps for them."
3,When felt lonely about writing my family.
4,Person talking about a situation while eating.
5,"Felt it after I spoke terribly (got mad at) the person who is the  
most important in my life."
6,Not giving up something for Lent.
1,Every time I see a spider or a snake.
3,The first time I left home.
4,"On a camp - boys and girls in one cabin. One guy forced himself  
upon another girl and was having intercourse, while the girl in  
the bunk beneath was pretending to be asleep and not be ill."
3,Close relative is dying of cancer - found out last week.
4,"Doctors ignored relative who complained about pain, and is now  
dying of cancer."
5,"One of my best friends'fiancT broke off the relationship because  
his feelings for me were stronger than for her. I felt the same  
for him, but did not really encourage him to leave her or stay  
with her - still felt shame."
3,After the fact that made me ashamed I felt sadness.
4,"A person that eat half of a cockroach in a cake without knowing  
it."
5,"A situation where we were the center of attention, and things  
happened without my control on them, that showed our disagreement,  
and ignorance."
6,When I let a person assume a fault that I committed.
0,"When finally I found a place to live, I felt relieved, predicting  
changes in my life, and I became happy."
1,When I dreamed that I was being attacked by a friend.
3,To fight with a sister and to know that she doesn't care.
4,To be kissed by soembody I didn't expect to.
6,"When I finished a love affair where I was responsible of the sad  
end."
3,"I felt it when I was at home and saw a discussion without sense  
between my parents."
4,"When I see all the putridness of people. The fact is the catarrh  
and spits that whash the streets of S.Paulo."
5,"I felt it when I felt that I was being observed as an object of  
pleasure (sexual) when I opened and took off a shirt in a  
classroom at P.V.C."
6,"I felt it when playing I pushed my brother and he fell down  
cutting himself in pieces of tile."
1,"When I almost drowned myself in the municipal swimming pool that  
I use to go almost not excaping."
3,The death of my grandfather.
4,"To go through the underground way at suburb station of LAPA. Poor  
people and the ambulants badly dressed up in a passage badly  
kept."
2,When an unknown person provoked me verbaly and physically.
3,When my team lost a championship.
4,"A dirty person, smelling bad and unknown laying on me."
0,"When I began to date a boy with whom I am till now. This was 16  
months ago."
2,I learned that my girlfriend had been unjustly missed from work.
3,I got separated from the man I loved.
4,"An acquaintance of mine revealed himself in a light unexpected to  
me."
0,"When I took my entrance exams successfully and also when I got my  
school leaving certificate because the delivering ceremony was  
extremely official."
1,"When I was to sit for my first entrance exam. I had fear of a  
possible failure."
2,"I was indignant at the unimpartiality shown by the referees at  
the football match between Bulgaria and France."
4,"When I was watching some scenes from the Bertoluchi's film  
""Twentieth Century""."
5,When I was a school girl and I copied at a class work.
6,"When I have sometimes been unfair to my parents, when I have  
happened to deceive them over some trifling things."
0,When I was admitted to the Sofia University.
1,When I come home late at night.
2,"When I talk to silly, petty-minded and unmanageable people."
4,When I happen to witness some sadistic acts.
5,When I have a plain appearance.
2,My grandfather's funeral.
3,I was alone at home on New Year's Eve.
4,I was on a walk with my child when I met a drunk woman.
5,I was unaware that I had walked the streets in torn trousers.
6,"Once I worked as a designer. A fitter was hard hit in a damage  
that occurred at the building site I had designed."
0,My admittance to the University.
1,A grenade blew out next to me.
3,Unrealisation of the desired profession (aviator).
4,Disgust with a subordinate.
6,Betraying someone's trust.
6,Friend's fiancT left her for me.
1,"When in a car accident where car was total wipe off (wipe out, or  
write off)."
2,With self at losing an important game that I should have won.
3,Death of grandfather (unexpected).
4,"Someone smoking on Electric train (Electric trains are  
non-smoking) with alcohol smell coming from person.  "
5,When bathing at surf beach & lost togs.
2,"I was angry at a University tutorial when an ignorant loudmouth  
persisted in trying to dominate the conversation."
3,"I left my home in Melbourne to come to Q'land to study and before  
I hopped in the car I hugged my mother and shook hands with my  
father. Sensing immediately my father's sadness, I also had a  
flood of the same emotion."
4,"When one of my parents verbally, personally abused the other."
5,"I felt something akin to shame after a heavy night of drinking,  
along with waking up with a woman I had just met whose husband  
was an epileptic. I was later to know that she knew my mother."
6,"I felt guilty about talking negatively, and agreeing with a  
person who was doing likewise, about a non-present third person."
0,Being in love for the first time.
2,"As a child - about 8 years old - walking across a paddock - being  
set upon by another boy who claimed it was ""his land"" - being  
intimidated by the boy - crying, being punched, etc."
5,"As a child - being sent to the shop by mother - buying some  
chocolate - getting caught by mother."
0,"When I achieved my first 6 at University after a long string of  
3's, 4's and 5's (7 is the highest mark awarded, 3 is a conceded  
pass)."
1,"One night going downstairs, and hearing a strong stirring of  
brances, which was not the wind."
2,"I was informed by my flatmate that, when we'd moved into our  
flat, she'd expected us to buy our food separetely - this event  
actually happened some 5 months after our sharing began. Prior to  
this, she had said nothing."
3,"Having to decide on a termination of a pregnancy, after  
discussing it with friends, family and the man involved."
4,"When a friend didn't invite her own parents to her Graduation  
ceremony."
1,"On embarking on University life. I came from a different city and  
did not know anybody at the Uni. I was frightened because my well  
known and loved friends, also all my security had been taken  
away."
3,"Upon moving away from home for the first time to a different  
city, I felt no longer ""under the wing"" of my parents even though  
they would always be there to help me. I felt a sense of loss, I  
was now all alone in the world, responsible for my own actions."
4,"I was sitting at a rock concert, listening to an extremely loud  
band. A tiny baby in a crawler had been left by his young mother,  
right out in the sun next to a speaker, and was screaming -  
probably in pain."
5,"Because I was lazy and unthoughtful I did not get into contact  
with a very close friend when she shifted from the Gold Coast to  
Brisbane, for a month, despite her efforts to contact me. I felt  
shamed when I finally confronted her again."
6,"When I felt I had let my parents down, especially my mother, by  
having sexual intercourse for the first time, and a few times  
after that. Also, when I went on the Pill."
0,"The weekend after I argued with my parents I went home again and  
they couldn't have been nicer. As soon as I walked in, Mum kissed  
me, then Dad, and thanked me for the birthday presents I'd left  
for him, including a very sentimental birthday card."
3,"A very close friend from Victoria visited me over the holidays.  
Having enjoyed his company immensely over 10 short days, I was  
overwhelmed by sadness when he left to return to Victoria. 
"
4,"One of my flatmates and I came back to the flat Monday morning,  
to find a real Mess, left by the guy we share with."
6,"When my Bictorian ""friend"" was staying at my house we ere going  
places together, and sleeping together. At the time I had a  
boyfriend locally. The first time I had to face him after  
sleeping with the guy from Melbourne I felt very guilty."
1,"Attempted rape by 5 guys - held my arms behind my back and  
molested me, constantly threatening to beat me. Penetration did  
not occur as the driver of the car stopped that."
3,"When my son was diagnosed as having CEREBRAL PALSY, at age 5. He  
would have to endure so much labelling, stigma and discrimination,  
even though his case was relatively mild."
4,"I have an adopted Aboriginal sister I felt disgust due to the  
racism she has been subjected to."
0,"Receiving notification that I had made a successful application  
to the Speech Therapy course at Uni, gave me a very good feelig  
of achievment and joy."
1,Not included on questionnaire.
2,"My ex-boyfriend began to date my best friend. After they had been  
seeing each other, I found out that he had been sleeping with  
another girl, without my friend knowing, I told my friend what he  
had been doing behind her back."
5,"I recently became sexually involved with my sister's lover. I  
care for him very much, but I am ashamed of the hurt I may cause  
her."
0,"Seeing a close friend who had just returned from twelve months  
overseas."
1,"Finding myself alone in a public toilet block with a man known to  
have had great psychological disturbances."
4,"Viewing the results of senseless vandalism to a local primary  
school."
5,"I slept with a man purely because I found him physically  
attractive and was under the influence of alcohol."
6,"Inventing a fictitious series of events, as a result of which I  
ended up in a conflict with my two closest friends."
0,"When I finished my exams after 12th Grade, I was worried about  
getting a T.E. Score high enough for Physiotherapy. When I found  
that I had been accepted I was ecstatic, or more appropriately,  
could jump for joy."
2,"When a so-called friend let me down, when she promised to tell me  
when a certain concert was occurring, and that she'd get me  
tickets. I was really looking forward to it. She did nothing,  
just told me out of the blue one day what a fantastic concert it  
was going to be."
4,"When I found out how the people of Ethiopia were starving and  
their government was spending millions on celebrating being in  
power so many years. Then I saw all these people on TV needing  
food, etc."
5,"I went to visit Montrose home for crippled children to interview  
a handicapped child. I interviewed two boys and it went really  
well. I promised I would visit them, but never got the time. Now I  
hope they've forgotten me, but I feel ashamed of letting them  
down."
6,"I was driving my parents' car into a carpark in front of a shop  
we own, and scraped the corner of the front panel on the back  
corner of my father's utility. I didn't tell anyone, I lied about  
the bump (later I had to confess)."
0,"Two years ago, somebody I like very much wanted to give up his  
studies. I tried to make him understand the importance of what he  
was going to do, not only of the difficulty to find a job but also  
because he will decrease his culture etc. This person made the  
test to the college entrance examination and to our great joy we  
found out that he succeded in entering at the University."
1,"One night, when I got out from the University I saw two strange  
people near my car. When I got near, they moved away, and then  
came close again. I had a feeling that they were assaulters.  
After I left I discovered that the windshield was broken."
3,"I don't know why suddenly I thought that what I was feeling for  
my boyfriend was not really love. After almost three years being  
together, this matter of fact shaked me and I felt a great sorrow  
that I can call sadness."
6,"When I was a little girl about eight years old I broke the bey  
from a closed. Mother asked who did it. I said that it wasn't me, as  
I almost never lied, and my brother did it more frequently in  
spite my brother denieing it my mother gave him a few slaps."
1,"One night I and my friends went to the cemetery. We stopped the  
car in front of the wall and suddenly the grave digger appeared  
over the wall looking like a ghost. I was already afraid and  
almost died."
2,"When one teacher unjustly gave me zero in a test saying that I  
was cribbing."
4,"I went to a restaurant with my boyfriend for dinner. There we saw  
a couple. the man of the couple was a negro and he hadn't manners  
for eat."
5,"When the teacher asked me to read my composition that was the  
homework I stood up and invented one because I hadn't done it. A  
colleague saw that in my copy book there was nothing written and  
he accused me and so I was called in the director's room."
6,When I took away my best friend's boyfriend.
0,"When in the end of a semester I got the approval in a matter that  
I judged very difficult."
2,"I went to the school library and asked for a book, but the  
librarian told me that there wasn't such. However when an other  
colleague asked for it she gave it to him."
3,"Some colleagues decided to go out on a Saturday not inviting me  
to decide either the place nor the time."
5,One day in the intimity with my girlfriend I had an ejaculation.
6,When I answered to my mother with rudeness.
3,I felt sad when I was despised by another person.
4,I felt disgust of dirty.
6,I felt guilty when I couldn't help a person.
0,"When I got through the examination for my driver licence, and  
when I finished I knew I had passed it."
2,When they changed my office to another room without my agreement.
3,"I couldn't sleep, and began to remind of my childhood. We are many  
sisters and at that time we were spanked a lot and I don't know  
why I started to remind of the spanks they and I had had, their  
shouts when this happened."
