Emotion,Comment
6,"A close friend of mine was leaving for graduate school out of  
state. I had arranged to gather some people together the day  
before he left to be with him and have a good time, but I didn't  
pay as much attention to him as I should have."
1,"I was on this amusement park ride at Marriots Great America. It  
went way up in the air and then around and around. Heights are  
not my favorite spots in life."
3,"Recently, my sister-in-law's horse was poisoned by a plant and  
died. The horse was very obedient and exceptional with children."
4,"I was disgusted at the behavior of these boys I work with in the  
scouting program. They showed a lack of interest, unrest, and at  
times just plain rude behavior."
5,"I had a test in the class and I had not adequately prepared  
myself. I didn't fare so well on the exam and I felt bad about  
it."
6,"I was supposed to have done some things for my mother, but just  
plain didn't get around to it."
0,"My old boyfriend - yes the same one - asked me out. We had a good  
time. Then he asked me out the following week. He actually took  
interest."
1,"I was physically assaulted and sexually abused about a year ago.  
Just the feeling that I might not get away intact, or even alive,  
produced fear."
3,"My nephew's mother just left one day (my brother and she were  
not married). My nephew, Anthony, was shaken. I was sad for him  
because a similar situation happened to me."
5,"I tried after months to begin talking to my boyfriend again. He  
ignored me. I felt I had lowered my pride and became his  
""doormat""."
6,"I had found out that I was pregnant. I talked it over with my  
boyfriend and he was unsupportive - yet encouraged an abortion -  
I did."
1,"My apartment has had three robberies in the last month. The guy  
upstairs just got robbed making it the fourth."
2,"When my roommate's boyfriend assaulted me. He was threatening me,  
calling me names and pushing me around."
3,"I was going to go on a vacation to Texas this summer but was  
unable to go because of registration."
4,"I didn't do very well on a midterm and I'm disgusted with myself  
because I was prepared and thought I did well."
5,When I dated my friend's boyfriend after they had broken up.
6,"A friend was going to come stay the weekend with me, but  
something came up and I cancelled out on him."
0,"After being depressed because of a very bad relationship, my  
first love called me and told me that he would always care for me  
no matter what I did."
3,"My mother kicked my surrogate father out and he in turn did not  
care for the dog, Afthur, he bought for the family. His lack of  
concern lead tho Arthur's death on the freeway. I loved Arthur  
like a brother. He was easy to talk to."
4,"I thought that the guy I had been associating with for over a  
year went out 2 or 3 times with a high school girl whom he claimed  
not to like."
5,"The fact that I was pregnant. I was always considered level  
headed and did not have sex until 18 and out of high school."
6,"I was pregnant and thought that by not having the baby I would  
hurt the father like he did me regardless of the life we had  
created."
1,"When I walked to church with my roommate, a bum told us to call  
the police and he started following us."
2,When my roommate's moped was stolen I was very angry.
5,The same for guilt would apply.
6,"I added a little   ?   to a yield in an experiment to get more of  
a yield."
0,"Third highest grade in the class and the best answer given for  
one question (the question was graded by the professor and he  
indicated he liked my answer)."
2,"We are repainting rooms in my house. My mother started to enact  
plans to paint my room without consulting me."
3,"Recent break-up with my girlfriend. We had been together for over  
a year. I was overseas and discovered over the phone (while I was  
at work)."
4,"I attended a ceremony in Denmark which is comparable to our  
Halloween. They build a large bonfire and place a life size dummy  
of a witch. The crowd cheered when the dummy burst into flames."
0,"After watching the 49ers lose game after game, year after year, I  
was finally rewarded with a Super Bowl victory which made me  
extremely happy."
1,"While swimming, I hit my head at the bottom of the pool and  
required stitches. I later learned that the consequences could  
have been much more severe and that terrified me."
2,"I was rushing home from school because there was a 49er game that  
night. I got into a non-injury accident, which was all my fault,  
but destroyed the front of my car. The truck I hit was undamaged."
3,"When I learned that my dad had cancer. I knew he was going to the  
hospital for some tests. My mom told me when she picked me up one  
weekend from CAL to take me home."
4,"Now that the 49ers are winners, the fans are coming out of the  
woodwork and jumping on the bandwagon and that disgusts me."
5,"When I was small, I would always fight with my younger sister and  
one time I hit her and knocked the wind out of her. I felt real  
bad about it."
0,I felt joy when my boyfriend proposed to me in marriage.
1,I felt fear when I was young and left in my big house all alone.
3,I felt sad when my boyfriend and I were apart for some time.
4,"I felt disgusted when I was in a restaurant which didn't appear  
to be clean and orderly. (I do not like to be in unclean  
environments)."
5,"I felt ashamed when I was confronted by a teaching assistant that  
a close friend and I were accused of cheating on a math exam."
6,"When I did not defend my close friend when my father degraded  
him. I felt guilty for allowing my father to get away with his  
actions and for the hurt my friend felt. I cleared the matter up  
with my father a few weeks later."
0,"After much trouble getting together in the first place my  
boyfriend and I celebrated our first anniversary."
4,"I took a psych. experiment with a totally unappealing gay man as  
the experimentor, some homosexuals are funny or cute, but this  
guy was disgusting. Plus the experiment was about gays too."
6,"I've had three midterms in the past two weeks and I hardly  
studied for any of them (like 1 or 2 days) I feel guilty that I  
hadn't studied and I got C's on all of them."
0,"Winning a close volleyball game. (I'm on the intercollegiate team  
at CAL)"
1,Speaking in front of a large group of people.
3,When a close friend drowned in the American River.
4,Getting a low grade on my physics midterm.
6,"When my father's car got stolen from me. (A 1966 Ford Mustang -  
very hard to replace)."
0,"Getting sent on a company expense trip to another state to work  
for a week at that plan."
1,"On my second plane trip, we ran into unexpected turbulence."
2,"Having my personal objects rearranged by someone else without my  
consent and having it arranged to their taste. Then trying to  
find a particular object they rearranged for an hour or more."
4,"Getting back my math midterm, I received a lower grade than I  
thought I would get. After going through the questions I felt  
that the grader had graded harshly and I had made only a few ?  
errors."
5,Getting a low grade on a midterm.
6,Promising to do a task for a friend and just forgetting about it.
0,"When I finished my C.S. Project I was overjoyed. I felt relieved  
because it was due the next day and I was tired of looking at it."
1,"I overturned in a canoe a few years back and I didn't know how to  
swim. Although I had a life-jacket on I still panicked."
2,"I came out of the house at 7:20 am Monday morning getting ready t  
go to school and fight for a parking when I saw my car had a flat  
tire."
3,"After my little sister's Graduation from High School my  
grandmother became very sick. She passed away a few months later."
5,I felt this when I was copying homework for one of my classes.
6,"After yelling at my girlfriend, I felt bad because she was ?  
crying and upset."
0,"A party with no worries (i.e. no tests homework etc.) many  
friends were present and good music."
1,"I'm afraid of not being able to go to the school I want because  
of suffering grades."
2,"I was stood up for a date function by someone who I really cared  
for."
5,"I was supposed to do something and didn't. The person was really  
dependiong on me."
2,"When my dad told me about something he had done against my  
mother."
3,When I heard my sister got in a bad car accident.
4,An Engineer I know wants war so he can get a job making bombs.
5,I did bad on a test I didn't study for.
6,"Decided at the last minute not to do something that I said I  
would do with a person."
5,When I failed the S.S.C examination I felt very ashamed.
0,"My first feeling of falling in love.  Coming across a person who  
made me feel love, happiness, joy, giving me a new and beautiful  
future, who made me dream."
3,"When I came to know that my feelings for someone were not  
reciprocated."
5,"I had a habit of wetting my bed when I was young.  One day, when  
I was invited to my friend's place to stay for the night, it  
happened again.  I was ashamed of myself."
6,I felt guilty when I lied to my parents.
1,"A few weeks back my daughter had very high fever and I was scared  
that it might lead to brain damage or convulsions."
2,"I felt angry when my mother-in-law did not handle my daughter  
properly and she fell down from the bed and hurt her head."
4,"When my parents-in-law scolded me, without any reason, in front of the  
other members of my family for the first time.  They had called  
me from my room where I had been studying for my exams."
5,"When the teacher asked me a question in class, concerning  
something I had read earlier, and I did not know the answer, so I  
felt ashamed in front of the whole class."
6,"When my friend failed an exam by just one mark.  During this exam  
she had asked me to show her my answer sheet and I had not done  
it.  When the results came out, I thought that had I shown her my  
answer sheet she would have passed the exam.  I felt guilty as I  
had failed her."
1,When I decided to separate from my husband.
2,"When my father talks about our relatives and favours them, I feel  
angry."
3,[ When my elders do not understand me in the right way.]
0,"I went for a walk on the beach with a friend whom I had not seen  
for many months.  The weather was very pleasant, we had some  
ice-cream and lots of fun on the beach."
1,"That day I was alone at home after coming home from school.  I did  
not know where everyone else had gone, I kept waiting for them to  
come back and nobody came.  It was getting very late and I was  
terrified."
3,"A close friend of mine was to get married in a weeks time when  
her father died of a heart-attack.  I knew him well and felt bad  
on hearing of his death."
4,"A girl, who is a friend of mine was having an affair with a boy  
who is also a friend of mine.  I got to know that this girl was  
also seeing another guy.  Later on, she just broke off with this friend  
of mine without giving any explanations.  This made him sad and  
depressed, and I felt disgust for this girl."
5,"I had always been first in my class and in the preliminary board  
exams I scored the highest marks.  Then the exams were  
postponed and I neglected my studies as I was confident.  However  
when the final results came out I felt ashamed as I had scored  
less than 60% marks and my rank in the class was fifth or sixth."
1,"I had gone to the hospital for my research and got late in  
reaching home.  I feared that when I reached home there would be  
a quarrel because of my being late."
2,[ I feel angry when somebody is unjust to me.]
3,[ I feel sad when somebody is unjust to me.]
4,When people around me did not understand me the right way.
2,I was angry this morning when I missed the train to university.
5,"I felt ashamed when I had not attended a class and the teacher asked  
me the reason for my absence. "
0,"I acted in an English play in college and got the Best Actress  
award, while our play got the first place."
1,"I have done the teachers training course (B.Ed).  During our  
training I was asked to handle the ninth standard class in a boys  
school.  I was scared to face the class the first day."
2,"I was to meet a friend at the bus-stop (he was coming to visit  
us) and he did not turn up.  After having waited for him for some time      
(about an hour) I called him up, to be told that he did not  
intend to come as he was feeling tired."
3,When my sister died in a fire accident at home.
4,When my husband told me about his pre-marital affairs.
5,When I failed the ninth standard exam in school.
6,"I had gone to see one of our professors about a book, and I did not  
 attend the class she took a few minutes later. 
"
0,"When I passsed the M.S.C board exams with first class, which I  
had not expected."
1,"[ I have always been very scared and tense before an exam and  
before the declaration of the results.]"
2,"When my friend promised that she would come to my place, and did  
not turn up - I was annoyed at her."
6,I felt guilty when I lied to my parents.
0,I was very happy when I passed the B.A with first class marks.
2,"I was having an argument with my brother on his behavior, then we   
started fighting and I got annoyed at him because he started  
teasing me."
3,"My best friend got married and left her home-town to go and live  
in Poona.  After her wedding I felt sad."
4,"I feel disgust at my neighbour, because she comes to our house with  
her child, who spoils our furniture."
5,"When I failed the twelveth standard exams I was ashamed at  
having to see my parents later."
6,When my mother scolded me and I argued with her.
0,When I passed the B.A exams with first class results.
1,When I was coming back home alone at night.
2,When I failed the M.S.C exams.
3,When my father was ill.
4,"When my friend who is close to me got engaged and did not invite  
me."
5,When I failed the M.S.C exam.
6,When I fought with my friends.
1,"When I was 20 years old, I fell severely ill and was bed-ridden for  
6 months.  I felt very scared for my health and my studies."
3,"My friend got married and went abroad, this made me feel sad and  
lonely."
4,"When a begggar approached me for money, I felt disgusted."
5,When I got 1/2 out of 15 in Abnormal Psychology I felt ashamed.
6,Once I lied to my parents and this made me feel very guilty.
0,"When I got a first class in the twelveth standard exams, I was very  
surprised and happy and I had a very good time with my friends."
2,"When I was at S.Y.Bajaj I wanted to get admission in another  
college and this was not easy and I felt angry. "
3,"When my mother scolded me for something, very insignificant, without  
knowing the real cause of what had happened. "
4,"I feel disgusted at my cousin, who is bad-mannered, does not know  
how to behave and talk to others, he does not respect elders and  
lies all the time."
6,"When I was taking the 11th standard exam, my friend who was sitting  
behind me asked me for some answers.  The teacher looked at us  
just then and scolded both of us.  Everyone started looking at us  
and I felt very guilty."
0,"After completing high-school, I wanted to go abroad for a  
holiday.  I had never been abroad before and neither had I taken  
a holiday for a long time.  When finally my parents agreed and we  
got the airplane tickets I was over joyed."
1,"It so happened that while staying at anaunt's place I discovered  
that I was afraid of sleeping in pitch darkness.  The room  
which my sister and I were sharing had no light, and I would  
refuse to sleep without having the light of the adjoining  
bathroom switched on."
3,"When I see people with burns I feel sad, actually I can not even  
express my feelings as I think that they must suffer a lot."
5,"When some of my close friends and colleagues talk about me and  
my work and say that I am the brightest student of the college."
0,"Day before yesterday my mother bought me a new pair of shoes,  
without my having asked for them.  She told me that when she saw  
the pair of shoes she felt like buying them for me.  I really  
liked the shoes and they made me feel that my mother cares for  
me."
1,"When for the first time I rode on a motorcycle with my brother.   
He was going so fast that I felt that I would fall off without my  
brother realizing it."
2,"One of my friends asked me to go shopping with her, another  
friend of hers was also coming along.  During the outing they  
kept talking to each other and I felt left out, even when I tried  
to talk to them they seemed not to listen to me and did not pay  
me much attention."
3,"Two years ago my best friend died in an accident, just a day  
before my birthray.  We were very close to each other and I felt  
very sad at loosing a close friend."
4,"We had gone to our native village and I went to visit a tribal  
group which believes in Goddess Kali.  As it was a festival day they  
had to offer a hen to the Goddess so they cut the head off a hen  
right in front of my eyes.  I felt disgusted and evenb gave up  
eating meat after this incident."
5,"As part of the assessment I had to speak on a subject in front  
of the class. I was not really prepared and I was just reading  
the stuff I had on a piece of paper, when some of the students   
asked me something I could not give them an answer.  I felt  
ashamed as I had not prepared the topic."
6,"One day I went to see a movie without my parents permission.  It  
was an adult movie and I was scared that my parents would not  
allow me to see the movie.  However after coming home I felt very  
guilty at what I had done."
0,"When my daughter gave her solo dance performance in Poona and  
there was a big applause, I was overjoyed."
1,"I was in a garden one evening and I saw a snake coming towards  
me."
3,"When my husband lied to me, tricked me and when I had to leave my  
home."
4,"The way my husband and his family treated me - unfairly, cruelly,  
and unjustly."
5,"I was ashamed at myself for having shouted at my daughter because  
of my marital break-up and the unfair way I was treated."
0,When I got married.
2,"A girl whom I trusted and with whom I had shared personal, confidential  
matters twisted the facts and told it to a common friend of ours.  
 When this common friend told me the version my friend had told  
her, I was angry."
3,When my elder sister died.
4,"My husband falls ill and does not follow the doctor's advice on  
the treatment or the diet control."
6,"When I could neither measure up to the expectations of the teacher  
nor to my own expectations in one of the assignments."
0,"The day I got married was the happiest day of my life.  Both of  
us felt that we were right for each other in every way and we had  
no doubts about our compatibility right from the day we got  
engaged."
2,"One morning I was standing at the bus-stop and the bus passed by  
without stopping, even though there were only 8-10 passengers  
inside.  I felt angry at the rude behaviour of the bus driver and   
conductor."
3,"At the death of my friend's father and especially as this  
happened ten days before her wedding."
4,"I was disgusted at the existing red-tape in the government  
offices.  I accquired my passport three months after having applied for  
it and I had to go back five times to them to correct a minor  
error."
5,"When I could not pass my exams with good marks.  My wedding was  
to take place 15 days after the exams and I tried to convince  
myself that this was the reason for my not having done well.    
However, I thought that had I really put my mind to doing well at  
the exams I would have done well."
0,"When I succeeded in achieving a scholarship for which I had  
strived hard during a period of financial, personal and physical  
stress."
1,"When I had to travel alone, unescorted for the first time.     It  
was an over-night journey by train to a distant place."
3,"I put in two years of hard work and it was neither looked at nor  
appreciated."
4,"Despite my being affectionate, sincere, and helpful to close   
relatives of mine; they turned around and accused me of being  
inconsiderate in my relationship with them."
5,The first time that I had to go up on the stage to give a speech.
0,"[ I feel a sense of joy whenever I complete a piece of writing  
which is part of my work.  Intense reading also brings me joy.  I  
also feel happy when I reminiscent about them.]"
1,"I was coming home from a relative's place and it was about  
9.30/10 P.M.  I felt slightly apprehensive when I got off the bus  
and started walking towards my place.  I was confident that  
nothing would happen to me, yet there was this slight feeling of  
fear."
2,"Uncleaniness at my work place.  The place is generally not very  
clean, but when it reaches a point, I get angry at the person  
who is supposed to clean the place and the people who are  
supposed to supervise him."
5,"I got into a tight pair of trousers and examined myself in the  
mirror.  My back looked unpresentable and I felt ashamed at my  
wanting to wear those clothes that day.  I quickly changed into  
another dress."
6,"When I do not put in the needed amount of hours of work or study  
for the day, I feel guilty and try to make up for the lost  
time."
0,"When I got the scholarship I was very happy as the finacial  
burden of the family was reduced."
1,"I experienced fear when I was not prepared for the final year  
degree exams."
2,"When the others did not do their bit of work on a group  
assignment task, and I had to do all the work."
5,"I felt ashamed when I fought with my mother on some issue, and  
caused her trouble."
6,"I had enough time to do my assignment, and I did not do it well.   
When the lecturer scolded me, I had this feeling."
0,When I was selected at TISS X.
1,When I almost walked on a snake.
3,When my mother left for Kenya.
4,[ When I see that the toilet is unclean.]
6,When I could not complete my assignment on time.
0,"At the pre-university, I was appreciated as an examplary  
student by our pricipal.  This is something which made me feel  
very happy."
3,"When my sister lost her only son, who was sixteen years old.  I  
felt very bad about it as this was the first death in my family  
and then I learned slowly to understand to life."
4,"When I was in a Christian institution, sometimes the nuns would  
send back the people who came to visit us when it was not the  
visiting hours.  This disgusted me."
0,"The day I got a letter from the U.G.C informing me that I had  
been awarded the junior research fellowship."
1,"When I was working in Delhi, I had gone alone to see the hostel  
where I would be residing."
2,"When a relative, who had come to our place, created untidyness  
and dirtyness."
3,When I had to leave home to go to some other place to study.
5,When I broke-down while seeing off my friend.
0,"[ When I have achieved what I wanted to achieve, I feel the above  
stated emotion. Also when I am sucessful.]"
1,"Once when I was walking alone at mid-night, I happened to put my  
foot on a frog, as it felt smooth I thought that it was a snake   
and I felt afraid.  
 
"
2,"My friend and I were to attend a very important meeting and he  
had promised to come and pick me up.  But he did not turn up and  
I felt very angry at him."
3,"I was really hoping that I would pass the examination, but I  
failed and so I felt very sad."
4,"[ I feel disgusted at people who talk negatively about a person  
without knowing the person well.]"
6,[ Whenever I do something prohibited or wrong I feel guilty.]
0,"When I stood first in the B.A exams.  Earlier I had heard of  
these boys and girls who were toppers, but when I first heard of  
me having topped I could not believe it."
1,"When my son fell off the cot at the age of 5 months, I became  
very nervous and thought that it would cause defects in his head.  "
3,"When I heard the news of the death of my father.  It was in the  
evening and I was alone all night in my room trying to remember  
the face of my father."
5,"One day I addressed my husband in an abusive manner in front of  
his friends.  Later on I realized this myself and felt ashamed of  
myself."
6,"My mother misunderstood me and prevented me from doing something.  
 In return I did not talk to her for a few days, only later on I  
realized that what she had done had been for my good."
1,"I felt afraid just before receiving the question paper of the  
part II exam."
2,"I remember that when I was in school I saw a case of partiality -  
one of the teachers gave private coaching classes to some girls  
and she would give these girls extra attention in class and would  
ignore the others."
4,"I was most disgusted when I had to make a nagging three day  
journey recently from Calcutta to Bombay.  It was very boring and  
tiring."
5,"I remember that once, a friend did not co-operate with me due to  
some unavoidable reasons.  Unaware of this I treated her unjustly  
till I realized everything, and then I felt ashamad of my deeds. "
6,"I did badly in one of the vital exams, despite getting proper  
guidance from my parents.  I felt guilty of improper use of the  
chances provided to me. "
1,"Fear is an emotion that I experience very often.  Naturally this  
is during exams and subsequently while waiting for the results.   
However there is one occassion when I was paralyzed with fear.   
This was when I was doing my M.A.-I, and we had a series of student  
lectures.  I was one of the participants and my lecture happened  
to be the opening lecture.  I had been confident all morning, about  
twenty minutes before the lecture, my confidence started failing  
me.  I felt my heart go cold, my lips go dry and I was really  
paralyzed.  This incident of fear is still fresh."
