Emotion,Comment
0,"On days when I feel close to my partner and other friends.   
When I feel at peace with myself and also experience a close  
contact with people whom I regard greatly."
1,"Every time I imagine that someone I love or I could contact a  
serious illness, even death."
2,"When I had been obviously unjustly treated and had no possibility  
of elucidating this."
3,"When I think about the short time that we live and relate it to  
the periods of my life when I think that I did not use this  
short time."
4,"At a gathering I found myself involuntarily sitting next to two  
people who expressed opinions that I considered very low and  
discriminating."
5,"When I realized that I was directing the feelings of discontent  
with myself at my partner and this way was trying to put the blame  
on him instead of sorting out my own feeliings."
0,"After my girlfriend had taken her exam we went to her parent's  
place."
1,"When, for the first time I realized the meaning of death."
2,"When a car is overtaking another and I am forced to drive off the  
road."
3,"When I recently thought about the hard work it takes to study, and   
how one wants to try something else.  When I read a theoretical  
book in English that I did not understand."
6,"When I think that I do not study enough.  After the weekend I  
think that I should have been able to have accomplished  
something during that time."
0,When I pass an examination which I did not think I did well.
1,"When one has arranged to meet someone and that person arrives  
late, in the meantime one starts thinking about all that could  
have gone wrong e.g a traffic accident."
2,When one is unjustly accused of something one has not done.
3,When one's studies seem hopelessly difficult and uninteresting.  
4,"When one finds out that someone you know is not at all like one  
had thought, for instance friends who steal and things like that,  
quite unwarranted."
5,"When one has been unjust, stupid towards someone else. "
0,Passing an exam I did not expect to pass.
6,When excuses are necessary and I get out of doing it myself.
0,When I had my children.
1,"When my 2 year old son climbed up and sat on the 7th floor  
balcony with his legs hanging out.  He was holding on tightly to  
the upper railing of the balcony but he could have easily lost  
his balance when he sat down."
2,When my partner was attacked and lost three teeth.
5,"When I saw my 18 year old son grab an oxygen mask as he had  
breathing difficulties.  I had a bad conscience because I had not  
stopped smoking.  Medication for the dilation of his breathing  
tubes also caused a sense of guilt in me."
6,"I experience a sense of guilt as my middle son cannot express  
himself like other children, neither verbally nor in writing."
0,When my child was born.
1,"It was spring and the ice was melting.  I was far out on a jetty and I poked the ice with a long branch to try and break it.
 The branch went through the ice and I fell in, the water closed  
in over my head."
2,"Unjust accusations directed at me and my way of acting, by someone close to me.  "
3,Failing an examination.
4,"A drunkard fell, started bleeding and wet himself.  Disgust that  
turned into sadness-unpleasantness."
6,"When I am in an environment or with a person much worse off than  
me, I realize how privileged I am."
0,When I saw a person I had not seen for a long time.
1,"When, as a child, I was nearly knocked down by a car."
2,"When I heard on the radio that the football match in Belgium had  
ended in a catastrophe, and several people had died.  I could not  
 understand how normal people could behave in such a way."
3,"When I feel lonely, perhaps because I have to study a lot and I  
am shut up in my appartment.  Nothing happens in particular  
because there is no time for anything else."
4,"When one learns through the mass media all the wars and killing  
going on in the world."
5,"I lied, to be precise I cancelled a meeting with a good friend."
0,When I was accepted for a course on finance and accounting.
4,"When I had just moved into my new appartment I found a ventilator  
in the kitchen.  I was going to clean it when I found that the  
drum was full of mud and slime.  I felt disgusted."
5,"My elder brother and I have not always had a good relationship  
and I feel ashamed of myself as I do not call him to talk to him  
nowadays."
6,"At my Summer job a new caretaker had been employed who was my age  
 but I preferred going out for lunch with the accounts personnel  
rather than with him."
0,Passed an exam by 2 points.
1,"In a cottage in a large forest, I was alone for a while in the  dark."
4,"I saw a cripple in rags with small children in Italy.  He was  
probably an imposter."
6,"I was the reason behind the break-up of my friend's relationship  
with his girlfriend.  She finished with him."
2,I locked myself out.
3,I missed the last tram home and had to walk in the pouring rain.
4,I found some worms in the food and I had obviously eaten some.
5,"My friend was so intoxicated that the police came and took him  
away, and they later contacted his parents."
0,When I won a trip to Greece in a competition.
2,"At work, when an elderly man complained unjustifiably about me and  
distrusted me."
3,When I had not understood anything after a lecture.
4,When an alcoholic stood dribbling over a food counter.
5,"When my friend and I were discussing the good looks of a guy we  
realized that he had been listening."
6,"When I complained about a colleague to the manager and he told  
her that someone had complained; this colleague came to me  
believing that I liked her."
0,"At a friend's birthday party with some of my closest friends.  It  
was all very pleasant and one could say that I was happy to have  
such good friends."
2,Mad at my dad.
3,A case of unrequited love.
5,Nearly caught masturbating.
0,I felt very happy when I won the football pools.
1,"When I flew from Athens to Copenhagen after a holiday.  The plane  
was caught in a storm and it began to shake and I thouhght that  
we were going to crash."
2,When someone stole my bike.
3,"When I saw the list of books to read for an acccouting course, I  
thought "" Oh God how will I ever manaage it!"""
4,"It was when I read a newspaper article on the future and they  
foresaw that we would be eating frog-burgers by the year 2000.   
An illustration showed a frog between two pieces of bread."
5,"When I dropped a bottle in the state liquor store and everyboby  
started laughing."
2,When friends try to put me down or hurt me.  
4,When someone makes advances that one does not want.
5,The discovery that one has only thought of oneself.
0,When I passed the first examination that I had to repeat.
2,When my boyfriend went away for a month long holiday without me.
3,"Last year when I worked during the Summer holidays and studied  
at the same time for an examination I had to repeat; my boyfriend  
went to Greece for a holiday for a month."
6,When I realized that I had three more examinations to take.
0,"The day I was told that I had been accepted as a student of  
economics."
1,"While taking a short cut through the Vasa park, I was surrounded  
by three people who tried to steal my money.  I was scared and  
was saved only by the appearance of other people."
2,"At a restaurant I observed how the gypsies tried to get money by  
cheating the foreigners i.e non Swedish speaking.  My anger had  
nothing to do with hatred against foreigners, but it was an  
expression of the anger I feel when I see people being used ."
3,"At the begining of a new course one is afraid of encountering  
problems one can not manage.  Thoughts revolve around failing  
the subject and the consequences it would have for the future."
4,"While walking in town I noticed how the police harrassed a man  
who was under the influence of alcohol.  They terrified him with  
the thought of arrest by driving close behind him on a pedestrian  
street.  My disgust was directed at the gestures and the facial  
expressions of the policemen; they seemed to be enjoying  
themselves."
5,"When my boyfriend revealed that he knew that I had discovered  
things of an important nature about him, I felt ashamed as I had  
not mentioned it earlier."
6,"When I am dishonest to a friend to whom I am very close.  I  
feel guilty because I know that he gives a different version of  
the truth and I have not corrected these mistakes, and he is  
aware that I know that they are wrong."
1,When my father was ill and was waiting for the results of his tests.
2,"When I got caught in the pouring rain last Thursday and did not  
have a raincoat on me."
3,When I failed an exam.
5,"When I had not prepared my contribution to the group as  
thoroughly as the other members, with the result that the  
overall result was poor."
6,"When my father and I worked on the house just after he had  
recovered from illness, I was rather lazy.  This meant that he  
had to work hard and was not very well later."
0,"When I gave birth to my son and saw that he was alive and that I  
had managed it well.  He was born a month too early with a  
malfunctioning lung.  This happened a year ago."
2,"When a colleague asked me for help at work, despite the fact  
that he had more time to do it than I had."
3,"When I did not get the salary increase that I had been expecting  
and understood how little one's work was appreciated."
4,When I was weeding the garden I found a lizard in my hand.
5,"When I met a friend whom I had not seen for a long time and  
heard all about her troubles, I thought that I should have got  
in touch with her earlier."
6,"I got angry at my mother for something trivial.  We were in a  
bad mood because my father was very ill and I knew that my mother  
really needed support.  I had reacted wrongly."
0,"New year's eve 1983/1984, I met my girlfriend.  We stood on the  
steps outside her parents home and I kissed her for the  
first time."
2,"The editor changed the heading of an article that I had written.   
He considered the heading to be derogatory towards the person I had written  
about."
4,"When I saw a picture, in the Gothenburg Post, of a totally  
demolished car with two fatally injured passengers.  The car was  
so badly damaged that they couldn't get the bodies out at the  
scene of the accident."
5,"One night I had a sexual intercourse with another man.  My sexual  
desire and my curiosity had made me jump into bed with him.  I am  
ashamed of myself now."
6,"Due to laziness, I failed the term studies completely at  
University.  I also wanted, to some extent, to protest against my  
parents' expectations."
0,When I got the loan for my studies.
2,"On the T.V I saw a news feature on South Africa.  A policeman       
attacked a group of black people with a whip."
3,"The thought of having to read a boring book of 400 pages in  
English."
4,Grovelling people.
5,My inability to assert myself positively in a group.
4,"Observing someone in the cafeteria noisily gulping in his food,  
having extremely bad manners."
5,"I guess I have often been ashamed after having talked badly of  
other people."
6,Having been angry and unpleasant towards my parents.
0,"When my sister - after a history of one abortion and one  
stillbirth - gave birth to a perfectly healty boy."
1,"When my sister had the still born child, she was emotionally very  
deep down, and it took her a long time to recover."
4,"I felt some disgust for my boyfriend for a time, after he had  
left me."
6,"Before an accident, my aunt offered me the front seat of the car,  
next to the driver. I declined, she took that seat and was killed  
there when the car crashed."
0,"Unexpected visit by a close friend, whom I hadn't seen for half a  
year."
4,Nothing.
6,Little contact with my father before he died.
0,"When I was accepted as a student at the college, not having  
thought it possible."
1,"When I was the first to arrive at the scene after an accident,  
and found that a close school friend had been killed."
4,Not applicable.
2,"I went to a lecture and once again it had been cancelled, this  
was the second time.  One had a negative attitude towards the  
lecturer. 
"
5,"When we were at home, my husband and I, he made a remark about  
something I had done, in a perfectly friendly manner.  My deed  
had been unjust and I knew that my husband was right, therefore my  
sense of shame."
1,"I went to practice in Sweden during summer, and I was afraid that  
I would not do well."
2,"In the holiday cottage of our association, two of my pals came to  
wake me up early one morning by bringing a radio played at the  
highest volume into my room - it was the morning service at its  
loudest."
3,My grandmother died suddenly last summer.
4,"My superior at the summer job swindled customers as much as he  
could, and once put me in a difficult situation after which I  
could not but detest him."
6,"Our association had Polish visitors and when they were going back  
by boat I did not go to see them off (I am the chairman of the  
association)."
6,"I had told my boyfriend that I did not want to go on with our  
relationship.  I knew that I was important to him but I wanted to  
be free.  I saw that this was difficult for him but I remained  
firm and did not change my mind."
0,"Last night I had a chat with a fellow student.  I had known her  
for about half a year, and for the first time we were speaking  
""the same language""- meaning an inspiring discussion and  
encounter."
2,"[ I sometimes quarrel with my mother because she blames me,  
though I have not in any way been connected to some events.]"
4,"In the evening, while I was watching TV, my little brother came  
in and started eating food he had brought from the kitchen while  
I was trying to concentrate on the program."
5,"My little brother was arrested by the police at the railway station after  
he had drunk some beer."
0,"I met a dear friend of mine after a long time.  I expressed my feelings  
in our own usual way, by mutual scolding and abusing (with  
complete understanding) and by touching, patting and taking the  
hand of the other person, etc..."
1,"I felt fear of the purest kind after a car accident.  The  
incident and images of horror kept coming back to my mind.  I  
wondered what could have happened to my sister, my friend and me,  
though nothing very serious actually happened."
2,"Two boys whom I know were telling me, in an indecent manner, how  
they had teased a young and shy girl I know.  They had despised  
her conviction, scorned and touched her.  I got very angry and  
did not try to conceal it and gave it back to them."
3,"My sweetheart left me, or rather we decided to break it off by  
mutual consent.  The consequences were - unrestrained weeping,  
feelings of loneliness, hopelessness and disconsolation.  I felt  
that I should find a friend, to talk to joyfully and to forget."
4,"Out of sheer curiosity, I went to see a pornographic movie in  
Copenhagen.  The room was full of men, who panted and  
masturbated.  Very disgusting."
6,Forced to fill in a questionnaire.
1,When my dog ran out on thin ice last spring.
2,"When my tennis match was interrupted because a kid cycled right  
into the court."
1,Risk of being involved in a fight after a party.
3,After an exam which I failed.
6,"I saw a neighbour, from the same appartment block as me, lying     
on the road.  He could have been injured or ill.  I kept 20  
metres away and did not go to help him."
1,"When I was cycling to school, I nearly got knocked down by a car  
which (overtook me too closely) did not give me any swerving space."
2,"When I was deputy manager during the Summer, certain deputies  
took liberties, more than what was normal."
4,Dog dirt which thaws in the spring.
6,[ Can not think of anything just now.]
1,Was nearly knocked down by a car.
2,"I reached the bus stop and realized that I had forgotten my bus  
pass."
3,"My current work load is too much.  The feeling comes back from  
time to time."
0,When my one year old son gives me a spontaneous kiss.
1,When someone close to me is travelling by car and is delayed.
2,When someone does something wrong which affects me negatively.
3,When I think about my parents getting old.
6,"I do not have the time for other people's problems.  My  
mother-in-law is sometimes depressed and I do not have the time,  
the desire or the strength to help."
0,"An ex-colleague asked me if I was interested in working in their  
accounts bureau.  They needed ""clever people"" and he had  
""immediately thought of me."""
1,"I was driving and a deer suddenly appeared in front of the  
car when there was a lot of traffic behind me."
2,I saw a report on T.V news on apartheid in South Africa. 
0,When my girlfriend became pregnant.
1,When I nearly collided with another car.
2,The time when someone let the air out of the tyres of my cycle.
3,When I read a lot and did not remember anything.
6,The time that I had to put my dog to sleep.
3,Long illness.
0,When I passed an exam.
2,When I missed the tram after having run for it.
3,The inability to read a book at college.
4,If a guy one is not interested in makes advances.
5,I drink wine too often.
6,I do not study enough as I do not understand it properly.
0,"I worked at a lawyer's office during Summer and I got a very  
good reference from him."
1,"I had been watching a triller a dark night in the country and I  
had to go the outside toilet on my own. "
2,"When I am accused of something I have not done, I get unbelievably  
angry."
3,"When I began to read a thick book, which I had a limited time to  
read.  Also when I have a lot of work to do and I cannot keep up."
4,Someone vomited on the street.
6,"I had lunch with my ex-boyfriend and did not mention it to my  
fiancee.  I felt guilty despite the fact that I felt nothing for  
my ex-boyfriend."
0,When I was finally qualified for my profession.
1,Someone attacked me with a knife.
2,Someone drove into my car and then denied that it had happened.
3,When I was told that my friend's wife had cancer.
5,When I boxed my child's ears.
6,When I was fined for speeding.
1,"I was going home by car late one night when it was cold, dark and  
windy.  I became rather panicky on the way to my house."
2,Quarrel in the family.
5,Emptied a bucket of water in a hospital.
0,When I get a hug from someone I love.
1,"I was driving very fast on a small road and I met an oncoming car  
in a right handed bend.  The other driver was on his own side of  
the road and I had to skid out of it to avoid a collision.  It  
was dark."
2,"My car had been towed away by the traffic police because it had  
been wrongly parked.  However the sign had been put up only after  
I had already parked."
3,After an operation I had to stay in bed for a long time.
4,"I was forced to stay in the canteen and eat the food that I had  
not asked for but got it anyway."
6,"By mistake I took a book from the library which was not supposed  
to be loaned out."
0,When I won an unexpected sum of money.
4,"In a warm bus full of people, someone vomited and the whole bus  
stank."
5,"I complained about a colleague's behaviour as she goes back on  
her word, is often absent and is irresponsible.  I found out that  
she was an alcoholic and was trying to fight againt her  
addiction."
6,"I spoke to my mother on the phone.  She had skin cancer and was  
waiting to be operated.  I forgot to ask her the date of the  
operation and just before finishing our conversation she gave me  
the date in passing. "
1,"When I was cycling through the park late one night, two people  
jumped out of the woods and tried to stop me.  There were  
shouting something at the same time."
4,"When I read a newspaper article on a young girl who had been  
raped and assaulted one night by several men when she was unconscious."
5,"My mother revealed personal details about me and the  
negative aspects of my character to other people when I was  
present but unable to defend myself."
6,"I was unfaithful to my partner once when he was working abroad  
for a long period."
1,When I saw a large spider crawling up the wall.
2,"My employer took too many aspirins for a bad back and also drank  
an enormous amount of spirit.  This was dangerous  and he did  
not understand that he had done anything wrong."
3,"When I left New York, and all my family and my friends behind me."
4,"When I slept with a guy because my best friend wanted me to.   
He had never had intercourse with anyone and had a terrible  
complex about it."
5,"When I dated a close girlfriend's boyfriend a few times. He told  
me that it was over between them and I accepted it.  When she  
found out she finished our friendship."
6,"When I broke off with my boyfriend after three years.  It was  
quite unexpected for him and there was no particular reason for  
the break up, such as someone else."
3,I feel sad about an event I can not influence.
4,"When a member of the family complains about the food that is  
served, it disgusts me."
6,"I have chosen to put my son in a private school were the  
examination marks are low.  Every time that he gives me his term  
results I am left with a sense of guilt."
0,"When I was informed that I had been accepted as a student of  
Psychology."
1,"When I was in a little fishing boat and we ran into hard weather  
in the open sea."
2,"When I found out that the guy I was dating at a particular time  
had a steady relationship going on with someone else for a long  
time."
5,"At primary school, when I vomited in front of others in the middle   
of a lesson."
1,When my son has a pain in his leg (for no apparent reason).  
4,"At a certain person's lack of cleanliness, at home and  
personally."
6,When I lost something that was valuable to my sister.
0,When my son was born.
5,When I was caught stealing money from my father.
6,"I stole a coconut cake from a reception table and when I put  
in my mouth I realized that the host was watching me."
1,"When I was reprimanded by the manager of the hotel where I  
worked during Autumn 1984."
2,"When my parents drove me to a nearby place and went home  
immediately instead of waiting a few hours.  They could have  
easily waited."
3,"When my ex-girlfriend and I discovered that there was a certain risk  
of her being pregnant."
4,"When I was about to clean the draining board and saw it looked  
underneath the sink (I live in a students hostel)."
0,"When my older sister told us that she was thinking of joining the  
rest of the family for the winter sports holiday."
1,"Slept in a chapel and in the middle of the night I realized that  
there was someeone else in the chapel.  I never discovered who  
it was and why he was there."
3,"I talked to my boyfriend on the phone when I was in high spirits  
and had a lot to tell him.  I had been looking forward to this  
conversation and he did not listen to me to the extent that I  
had anticipated."
6,"As I could not be home before midnight I called home at 11.30 and  
asked them to leave the door open so that I could get in.  I  
actually woke up the whole family by calling them so late.  My  
mother could not go back to sleep, besides she had a conference    
the next day and really needed to sleep."
0,When I got through the first day here at the department.
1,"When I was cycling past a parked car someone opened the door and  
nearly pushed me off my bike and into the traffic."
2,"When my boyfriend sat up half the night playing computer games  
with a friend."
4,When I saw a big spider from very close.
5,"When I asked a friend to return the money that I had loaned her  
and then remembered that she had repayed me in several ways."
6,"When one of my parents insinuates something about the other  
(they are divorced)."
0,When i was asked to be a child's godmother.
2,When my mother interfered in my life.
4,"The first time that I saw a surgeon cut off a leg and put it in a  
black rubbish bag."
6,When I demand too much from my friends.
1,When I was nearly attackad by a man who had been chasing me.
2,"When my father asked me if I was a communist, at the same time he  
made it clear that I should no longer see myself as his daughter."
3,"When I applied for a job which I thought I had a good chance of  
getting, I was not even granted an interview and did not get the  
job."
5,"When I as a child of 9 or 10 I was playing doctor with the  
neighbours boys their mother caught us."
0,"When we were able to afford a new sofa - a leather one which cost  
SEK 20000.  I had waited for it for 2-3 years."
2,"When my boss enrolled in a course to satisfy his own ends - to  
trample on his associates.  I have the misfortune to have one of  
my superiors in my course."
4,Spit and vomit.
5,Spots on the seat covers of my husband's car.
6,"Not speaking to my sister-in-law due to lack of interest in a  
relationship on my side."
0,"When I recently managed to get my first consulting assignment  
""myself"" i.e on my own initiative."
2,"When my friend, as usual, forgot the tickets at home for a  
performance.  We missed it."
3,"The elections of 1982 and 1985.  The thought of what a social  
democrat and communist majority could achieve, especially ""worker  
share"" funds and its extension."
4,"A study visit to a chicken factory : the butchery, the smell,  
the environment and the noise."
5,Confession to my parents about my involvement in a moped theft.
6,"[ No answer as I see very little difference between shame and  
guilt.  Therefore see answer for ""shame"".]"
0,"When I was appointed to position of trust in a group set up to  
change the working environment."
2,"When I tried to explain to a plumber, face to face, that the  
toilet was broken and he did not believe it (it had been mended  
ten times)."
3,"When the result of a project work was treated nonchalantly  
intead of being criticized by the teacher."
